<?xml version="1.0" encoding="UTF-8"?>
<mfb:MFBReturn xmlns:mfb="urn:centralbank:mfb:reporting:v1"
               xmlns:xsi="http://www.w3.org/2001/XMLSchema-instance"
               xsi:schemaLocation="urn:centralbank:mfb:reporting:v1 MFB_Return_Schema_v1.0.xsd"
               schemaVersion="1.0">

  <mfb:Header>
    <mfb:MFBLicenceNo>MFB/2024/00456</mfb:MFBLicenceNo>
    <mfb:MFBName>Sample Microfinance Bank Limited</mfb:MFBName>
    <mfb:ReturnType>PAR</mfb:ReturnType>
    <mfb:MFBCategory>State</mfb:MFBCategory>
    <mfb:ReportingPeriodStart>2026-03-01</mfb:ReportingPeriodStart>
    <mfb:ReportingPeriodEnd>2026-03-31</mfb:ReportingPeriodEnd>
    <mfb:SubmissionDateTime>2026-04-04T10:00:00Z</mfb:SubmissionDateTime>
    <mfb:ContactPerson>Fatima Abdullahi</mfb:ContactPerson>
    <mfb:ContactEmail>returns@samplemfb.com</mfb:ContactEmail>
    <mfb:ContactPhone>+234-9-876-5432</mfb:ContactPhone>
    <mfb:IsNilReturn>false</mfb:IsNilReturn>
  </mfb:Header>

  <mfb:PortfolioAtRisk>
    <mfb:PARBand>
      <mfb:BandLabel>Current (0 Days)</mfb:BandLabel>
      <mfb:DaysMin>0</mfb:DaysMin>
      <mfb:DaysMax>0</mfb:DaysMax>
      <mfb:NumberOfAccounts>8500</mfb:NumberOfAccounts>
      <mfb:OutstandingBalance>1200000.00</mfb:OutstandingBalance>
      <mfb:PercentOfPortfolio>80.00</mfb:PercentOfPortfolio>
    </mfb:PARBand>
    <mfb:PARBand>
      <mfb:BandLabel>PAR 1 (1-30 Days)</mfb:BandLabel>
      <mfb:DaysMin>1</mfb:DaysMin>
      <mfb:DaysMax>30</mfb:DaysMax>
      <mfb:NumberOfAccounts>650</mfb:NumberOfAccounts>
      <mfb:OutstandingBalance>120000.00</mfb:OutstandingBalance>
      <mfb:PercentOfPortfolio>8.00</mfb:PercentOfPortfolio>
    </mfb:PARBand>
    <mfb:PARBand>
      <mfb:BandLabel>PAR 30 (31-60 Days)</mfb:BandLabel>
      <mfb:DaysMin>31</mfb:DaysMin>
      <mfb:DaysMax>60</mfb:DaysMax>
      <mfb:NumberOfAccounts>320</mfb:NumberOfAccounts>
      <mfb:OutstandingBalance>67500.00</mfb:OutstandingBalance>
      <mfb:PercentOfPortfolio>4.50</mfb:PercentOfPortfolio>
    </mfb:PARBand>
    <mfb:PARBand>
      <mfb:BandLabel>PAR 60 (61-90 Days)</mfb:BandLabel>
      <mfb:DaysMin>61</mfb:DaysMin>
      <mfb:DaysMax>90</mfb:DaysMax>
      <mfb:NumberOfAccounts>180</mfb:NumberOfAccounts>
      <mfb:OutstandingBalance>45000.00</mfb:OutstandingBalance>
      <mfb:PercentOfPortfolio>3.00</mfb:PercentOfPortfolio>
    </mfb:PARBand>
    <mfb:PARBand>
      <mfb:BandLabel>PAR 90 (91-180 Days)</mfb:BandLabel>
      <mfb:DaysMin>91</mfb:DaysMin>
      <mfb:DaysMax>180</mfb:DaysMax>
      <mfb:NumberOfAccounts>120</mfb:NumberOfAccounts>
      <mfb:OutstandingBalance>37500.00</mfb:OutstandingBalance>
      <mfb:PercentOfPortfolio>2.50</mfb:PercentOfPortfolio>
    </mfb:PARBand>
    <mfb:PARBand>
      <mfb:BandLabel>PAR 180 (181-360 Days)</mfb:BandLabel>
      <mfb:DaysMin>181</mfb:DaysMin>
      <mfb:DaysMax>360</mfb:DaysMax>
      <mfb:NumberOfAccounts>50</mfb:NumberOfAccounts>
      <mfb:OutstandingBalance>22500.00</mfb:OutstandingBalance>
      <mfb:PercentOfPortfolio>1.50</mfb:PercentOfPortfolio>
    </mfb:PARBand>
    <mfb:PARBand>
      <mfb:BandLabel>PAR 360 (Over 360 Days)</mfb:BandLabel>
      <mfb:DaysMin>361</mfb:DaysMin>
      <mfb:NumberOfAccounts>15</mfb:NumberOfAccounts>
      <mfb:OutstandingBalance>7500.00</mfb:OutstandingBalance>
      <mfb:PercentOfPortfolio>0.50</mfb:PercentOfPortfolio>
    </mfb:PARBand>

    <mfb:GrossLoanPortfolio>1500000.00</mfb:GrossLoanPortfolio>
    <mfb:MicroLoanAmount>1260000.00</mfb:MicroLoanAmount>
    <mfb:MicroLoanPct>84.00</mfb:MicroLoanPct>
    <mfb:SMELoanAmount>240000.00</mfb:SMELoanAmount>
    <mfb:SMELoanPct>16.00</mfb:SMELoanPct>
    <mfb:PAR30Ratio>11.50</mfb:PAR30Ratio>
    <mfb:PAR90Ratio>4.50</mfb:PAR90Ratio>
    <mfb:WriteOffRatio>0.80</mfb:WriteOffRatio>
    <mfb:CollectionRate>92.50</mfb:CollectionRate>
    <mfb:ActiveBorrowers>9835</mfb:ActiveBorrowers>
    <mfb:AverageLoanSize>152.52</mfb:AverageLoanSize>
  </mfb:PortfolioAtRisk>

  <mfb:Signature>
    <mfb:PreparedBy>
      <mfb:Name>Aminu Garba</mfb:Name>
      <mfb:Designation>Head, Operations</mfb:Designation>
      <mfb:Date>2026-04-04</mfb:Date>
    </mfb:PreparedBy>
    <mfb:MDSignOff>
      <mfb:Name>Blessing Okonkwo</mfb:Name>
      <mfb:Designation>Managing Director</mfb:Designation>
      <mfb:Date>2026-04-04</mfb:Date>
    </mfb:MDSignOff>
    <mfb:CertificationStatement>I/We certify that the information provided is true, accurate, and complete to the best of our knowledge and in compliance with CBN MFB guidelines.</mfb:CertificationStatement>
  </mfb:Signature>

</mfb:MFBReturn>
